{
    "$schema": "./schema.json",
    "dialogYes": "Yes",
    "dialogNo": "No",
    "dialogOk": "OK",
    "newGame": "New game",
    "loadRecords": "Load records",
    "settings": "Settings",
    "language": "Language",
    "subLanguage": "Secondary language",
    "bgmVolume": "BGM volume: ",
    "voiceVolume": "Voice volume: ",
    "videoVolume": "Video volume: ",
    "none": "None",
    "about": "About",
    "goHome": "Go home",
    "goHomeConfirm": "Back to the home page?",
    "quit": "Quit",
    "quitConfirm": "Quit the game?",
    "error": "Error"
}