{
    "$schema": "./schema.json",
    "dialogYes": "はい",
    "dialogNo": "いいえ",
    "dialogOk": "OK",
    "newGame": "始めから",
    "loadRecords": "続きから",
    "settings": "設定",
    "about": "説明",
    "goHome": "ホーム",
    "goHomeConfirm": "ホームに戻りますか？",
    "quit": "終了する",
    "quitConfirm": "ゲームを終了しますか？",
    "error": "エラー"
}